{
    "containers": {
        "cna": {
            "affected": [
                {
                    "vendor": "string",
                    "product": "string",
                    "versions": [
                        {
                            "version": "string",
                            "status": "string"
                        }
                    ]
                }
            ],
            "descriptions": [
                {
                    "lang": "string",
                    "value": "string"
                }
            ],
            "problemTypes": [
                {
                    "descriptions": [
                        {
                            "description": "string",
                            "lang": "string",
                            "type": "string"
                        }
                    ]
                }
            ],
            "providerMetadata": {
                "orgId": "string",
                "shortName": "string",
                "dateUpdated": "2022-05-13T14:26:39.293Z"
            },
            "references": [
                {
                    "name": "string",
                    "tags": [
                        "string"
                    ],
                    "url": "string"
                }
            ]
        }
    },
    "cveMetadata": {
        "assignerOrgId": "string",
        "cveId": "string",
        "state": "string",
        "assignerShortName": "string",
        "requesterUserId": "string",
        "dateReserved": "string",
        "datePublished": "string"
    },
    "dataType": "string",
    "dataVersion": "string"
}
